{
  "content_base64": "Q2FwdHVyZWQgc291cmNlcyByZXRhaW4gdGhlaXIgb3JpZ2luYWwgYnl0ZXM7IGNsYWltcyBiaW5kIGV4YWN0IHF1b3RlZCByYW5nZXMuCg==",
  "evidence_id": "E-004",
  "format": "whykit.evidence-artifact/v1",
  "recorded_at": "2026-09-17T12:00:00Z",
  "sensitivity": "public",
  "size_bytes": 79,
  "source_version": "sha256:0aa321978f794bb048b587c157923b3cdd70510ecaf47ac8728572b9bc2dcf4f"
}
