{
  "content_base64": "MjAyNi0wOS0xMDogcmV2aWV3ZWRfaXRlbXM9MS4wMDAgaXRlbXMuCjIwMjYtMDktMTc6IHJldmlld2VkX2l0ZW1zPTIuMDAwIGl0ZW1zLgpTeW50aGV0aWMgZml4dHVyZTsgdGhlc2UgdmFsdWVzIGRvIG5vdCBlc3RhYmxpc2ggY2F1c2FsIGVmZmVjdC4K",
  "evidence_id": "E-005",
  "format": "whykit.evidence-artifact/v1",
  "recorded_at": "2026-09-17T12:00:00Z",
  "sensitivity": "restricted",
  "size_bytes": 144,
  "source_version": "sha256:fab761d309bb12500028ff74d7b094c3e62028c2148ade332442d7b17194e6ca"
}
